{
    "$schema": "schema.json",
    "sim_date": {
        "year": 2024,
        "month": 10,
        "day": 5,
        "hour": 12,
        "minute": 30,
        "second": 0
    },
    "orbits": [
        {
            "semimajor_axis": 149597870700.0,
            "eccentricity": 0.01671,
            "inclination": 0.0,
            "longitude_of_ascending_node": 0.0,
            "argument_of_periapsis": 4.938601104735675,
            "mean_anomaly_at_epoch": 4.894950420143297,
            "orbital_period_days": 365.256,
            "mean_anomaly": 4.894950420143297,
            "true_anomaly": 0.0,
            "center_position": {
                "x": 0,
                "y": 0,
                "z": 0
            }
        },
        {
            "semimajor_axis": 57909050000.0,
            "eccentricity": 0.2056,
            "inclination": 0.12226031410220278,
            "orbital_period_days": 87.969,
            "center_position": {
                "x": 0,
                "y": 0,
                "z": 0
            }
        },
        {
            "semimajor_axis": 108208000000.0,
            "eccentricity": 0.0067,
            "inclination": 0.05923647481268755,
            "orbital_period_days": 224.701,
            "center_position": {
                "x": 0,
                "y": 0,
                "z": 0
            }
        },
        {
            "semimajor_axis": 227939200000.0,
            "eccentricity": 0.0934,
            "inclination": 0.03228859116189509,
            "orbital_period_days": 686.98,
            "center_position": {
                "x": 0,
                "y": 0,
                "z": 0
            }
        },
        {
            "semimajor_axis": 778547200000.0,
            "eccentricity": 0.0489,
            "inclination": 0.02274164015348611,
            "orbital_period_days": 4332.589,
            "center_position": {
                "x": 0,
                "y": 0,
                "z": 0
            }
        },
        {
            "semimajor_axis": 1433449370000.0,
            "eccentricity": 0.0565,
            "inclination": 0.04337143191205908,
            "orbital_period_days": 10759.22,
            "center_position": {
                "x": 0,
                "y": 0,
                "z": 0
            }
        },
        {
            "semimajor_axis": 2872463710000.0,
            "eccentricity": 0.0463,
            "inclination": 0.013473941825396225,
            "orbital_period_days": 30688.5,
            "center_position": {
                "x": 0,
                "y": 0,
                "z": 0
            }
        },
        {
            "semimajor_axis": 4495060000000.0,
            "eccentricity": 0.0086,
            "inclination": 0.030874874467779687,
            "orbital_period_days": 60182.0,
            "center_position": {
                "x": 0,
                "y": 0,
                "z": 0
            }
        },
        {
            "semimajor_axis": 384400000.0,
            "eccentricity": 0.0549,
            "inclination": 0.08979719001510825,
            "longitude_of_ascending_node": 0.0,
            "argument_of_periapsis": 4.938601104735675,
            "mean_anomaly_at_epoch": 4.894950420143297,
            "orbital_period_days": 27.321661,
            "mean_anomaly": 4.894950420143297,
            "true_anomaly": 0.0,
            "center_position": {
                "x": 0,
                "y": 0,
                "z": 0
            }
        },
        {
            "semimajor_axis": 9376000.0,
            "eccentricity": 0.0151,
            "inclination": 0.01907644872429802,
            "orbital_period_days": 0.3189,
            "center_position": {
                "x": 0,
                "y": 0,
                "z": 0
            }
        },
        {
            "semimajor_axis": 23463000.0,
            "eccentricity": 0.0002,
            "inclination": 0.016231562043547268,
            "orbital_period_days": 1.263,
            "center_position": {
                "x": 0,
                "y": 0,
                "z": 0
            }
        },
        {
            "semimajor_axis": 421700000.0,
            "eccentricity": 0.0041,
            "inclination": 0.0008726646259971648,
            "orbital_period_days": 1.769,
            "center_position": {
                "x": 0,
                "y": 0,
                "z": 0
            }
        },
        {
            "semimajor_axis": 671034000.0,
            "eccentricity": 0.0094,
            "inclination": 0.008203047484373348,
            "orbital_period_days": 3.551,
            "center_position": {
                "x": 0,
                "y": 0,
                "z": 0
            }
        },
        {
            "semimajor_axis": 1221870000.0,
            "eccentricity": 0.0288,
            "inclination": 0.006073745796940267,
            "orbital_period_days": 15.945,
            "center_position": {
                "x": 0,
                "y": 0,
                "z": 0
            }
        },
        {
            "semimajor_axis": 354759000.0,
            "eccentricity": 1.6e-05,
            "inclination": 2.7381597969913036,
            "orbital_period_days": -5.877,
            "center_position": {
                "x": 0,
                "y": 0,
                "z": 0
            }
        }
    ],
    "stars": [
        {
            "name": "Sun",
            "body_id": "SUN",
            "spectral_type": 4,
            "spectral_subtype": 8,
            "position": {
                "x": 0,
                "y": 0,
                "z": 0
            },
            "rotation": {
                "x": 0,
                "y": 0,
                "z": 0,
                "w": 1
            },
            "right_ascension_rad": 0,
            "declination_rad": 0,
            "distance_pc": 0,
            "mass_kg": 1.98847e+30,
            "radius_m": 696340000,
            "surface_temperature_k": 5772,
            "core_temperature_k": 15000000,
            "luminosity_w": 3.828e+26,
            "bolometric_luminosity_w": 3.828e+26,
            "rotation_period_days": 25.05,
            "magnetic_field_gauss": 2
        },
        {
            "name": "Test Star",
            "body_id": "TEST_STAR",
            "spectral_type": 6,
            "spectral_subtype": 8,
            "position": {
                "x": 25000000000.0,
                "y": 0,
                "z": 0
            },
            "rotation": {
                "x": 0,
                "y": 0,
                "z": 0,
                "w": 1
            },
            "right_ascension_rad": 0,
            "declination_rad": 0,
            "distance_pc": 0,
            "mass_kg": 1.98847e+30,
            "radius_m": 6963400000,
            "surface_temperature_k": 9000,
            "core_temperature_k": 15000000,
            "luminosity_w": 3.828e+26,
            "bolometric_luminosity_w": 3.828e+26,
            "rotation_period_days": 25.05,
            "magnetic_field_gauss": 2
        }
    ],
    "planets": [
        {
            "name": "Venus",
            "body_id": "VENUS",
            "host_star_index": 0,
            "orbit_index": 2,
            "planet_class": 0,
            "position": {
                "x": 108200000000.0,
                "y": 0,
                "z": 0
            },
            "rotation": {
                "x": 0,
                "y": 0,
                "z": 0,
                "w": 1
            },
            "radius_m": 6051000,
            "mass_kg": 4.867e+24,
            "surface_temperature_k": 737,
            "atmosphere_type": 3,
            "has_rings": 0
        },
        {
            "name": "Mercury",
            "body_id": "MERCURY",
            "host_star_index": 0,
            "orbit_index": 1,
            "planet_class": 0,
            "position": {
                "x": 57900000000.0,
                "y": 0,
                "z": 0
            },
            "rotation": {
                "x": 0,
                "y": 0,
                "z": 0,
                "w": 1
            },
            "radius_m": 2439700,
            "mass_kg": 3.301e+23,
            "surface_temperature_k": 440,
            "atmosphere_type": 1,
            "has_rings": 0
        },
        {
            "name": "Earth",
            "body_id": "EARTH",
            "host_star_index": 0,
            "orbit_index": 0,
            "planet_class": 0,
            "position": {
                "x": 149597870700.0,
                "y": 0,
                "z": 0
            },
            "rotation": {
                "x": 0,
                "y": 0,
                "z": 0,
                "w": 1
            },
            "radius_m": 6371000,
            "mass_kg": 5.972e+24,
            "surface_temperature_k": 288,
            "atmosphere_type": 2,
            "has_rings": 0
        },
        {
            "name": "Mars",
            "body_id": "MARS",
            "host_star_index": 0,
            "orbit_index": 3,
            "planet_class": 0,
            "position": {
                "x": 227940000000.0,
                "y": 0,
                "z": 0
            },
            "rotation": {
                "x": 0,
                "y": 0,
                "z": 0,
                "w": 1
            },
            "radius_m": 3389500,
            "mass_kg": 6.39e+23,
            "surface_temperature_k": 210,
            "atmosphere_type": 1,
            "has_rings": 0
        },
        {
            "name": "Jupiter",
            "body_id": "JUPITER",
            "host_star_index": 0,
            "orbit_index": 4,
            "planet_class": 1,
            "position": {
                "x": 778500000000.0,
                "y": 0,
                "z": 0
            },
            "rotation": {
                "x": 0,
                "y": 0,
                "z": 0,
                "w": 1
            },
            "radius_m": 69911000,
            "atmosphere_type": 4,